{
  "$schema": "https://json-schema.org/draft/2020-12/schema",
  "$id": "urn:knowledge-automata:schema:core:ledger-entry:v1",
  "x-version": "1.1",
  "title": "Artifact Ledger entry",
  "description": "One artifact in the Artifact Ledger: what arrived, where its copy is, its status and an append-only history of every status change (ADR-0006, ADR-0015). Code owns every field. Never sent to an LLM provider.",
  "type": "object",
  "properties": {
    "schema_version": {
      "type": "string",
      "pattern": "^[0-9]+\\.[0-9]+$",
      "description": "Version (MAJOR.MINOR) of this Ledger entry schema. A status change raises it to the current minor version of the same major."
    },
    "id": { "$ref": "#/$defs/artifact_id" },
    "title": {
      "type": "string",
      "minLength": 1,
      "maxLength": 200,
      "description": "The first Markdown heading, or the file name stem. Set by the Sensor (intake and input guardrail)."
    },
    "source": {
      "type": "object",
      "properties": {
        "type": {
          "enum": ["file"],
          "description": "How the artifact arrived. Connectors add values later."
        },
        "name": {
          "type": "string",
          "minLength": 1,
          "maxLength": 255,
          "pattern": "^[^/\\\\]+$",
          "description": "The original file name only, never a full path."
        }
      },
      "required": ["type", "name"],
      "additionalProperties": false
    },
    "artifact_date": {
      "type": "string",
      "format": "date",
      "description": "The date the artifact describes, when the Operator (human in the loop) gives it at intake."
    },
    "media_type": {
      "enum": ["text/markdown", "text/plain"],
      "description": "Absent when the format is unsupported."
    },
    "size_bytes": {
      "type": "integer",
      "minimum": 0,
      "description": "Size of the file as received."
    },
    "content_hash": {
      "type": "string",
      "pattern": "^sha256:[0-9a-f]{64}$",
      "description": "SHA-256 of the bytes after removing a UTF-8 byte order mark and normalizing line endings to LF. Used for duplicate detection."
    },
    "stored_path": {
      "type": "string",
      "maxLength": 255,
      "pattern": "^artifacts/[A-Za-z0-9][A-Za-z0-9._-]*$",
      "description": "Path of the read-only copy, relative to the memory folder. Present for accepted, quarantined, processed and failed; absent for rejected."
    },
    "same_name_as": {
      "type": "array",
      "minItems": 1,
      "uniqueItems": true,
      "items": { "$ref": "#/$defs/artifact_id" },
      "description": "Earlier entries with exactly the same source name, in ascending order. Not a claim that this is a revision."
    },
    "status": { "$ref": "#/$defs/status" },
    "created_at": { "$ref": "#/$defs/timestamp" },
    "updated_at": { "$ref": "#/$defs/timestamp" },
    "produced": {
      "type": "array",
      "items": { "$ref": "#/$defs/produced_record" },
      "description": "Records written or revised from this artifact. Empty unless the status is processed."
    },
    "rejected": {
      "type": "array",
      "items": { "$ref": "#/$defs/rejected_draft" },
      "description": "Drafts that failed validation or comparison, kept across reruns. Empty unless the status is processed, or failed after an earlier processed step."
    },
    "history": {
      "type": "array",
      "minItems": 1,
      "items": { "$ref": "#/$defs/history_entry" },
      "description": "Every status change, oldest first. Append-only."
    }
  },
  "required": [
    "schema_version",
    "id",
    "title",
    "source",
    "size_bytes",
    "content_hash",
    "status",
    "created_at",
    "updated_at",
    "produced",
    "rejected",
    "history"
  ],
  "additionalProperties": false,
  "$defs": {
    "artifact_id": {
      "type": "string",
      "pattern": "^ART-[0-9]{4,}$",
      "description": "Artifact Ledger ID, for example ART-0001. Assigned by code."
    },
    "status": {
      "enum": ["received", "accepted", "quarantined", "rejected", "processed", "failed"],
      "description": "Artifact statuses from ADR-0006."
    },
    "timestamp": {
      "type": "string",
      "format": "date-time",
      "pattern": "^[0-9]{4}-[0-9]{2}-[0-9]{2}T[0-9]{2}:[0-9]{2}:[0-9]{2}Z$",
      "description": "UTC, YYYY-MM-DDTHH:MM:SSZ, as in records."
    },
    "record_id": {
      "type": "string",
      "pattern": "^[A-Z]{3}-[0-9]{4,}$"
    },
    "produced_record": {
      "type": "object",
      "description": "One record this artifact created or revised. model and prompt_version are the Registrar's draft.",
      "properties": {
        "register": { "type": "string", "pattern": "^[a-z][a-z0-9-]*$" },
        "record_id": {
          "$ref": "#/$defs/record_id",
          "description": "The record written: the new record for new and supersession, the revised record for update and reaffirmation."
        },
        "change": {
          "enum": ["new", "update", "reaffirmation", "supersession"],
          "description": "The change code applied. Absent in entries written before version 1.1, where it means new."
        },
        "related_id": {
          "$ref": "#/$defs/record_id",
          "description": "The record superseded. Present only for supersession."
        },
        "model": { "type": "string", "minLength": 1 },
        "prompt_version": { "type": "string", "minLength": 1 },
        "schema_version": { "type": "string", "pattern": "^[0-9]+\\.[0-9]+$" },
        "comparison": {
          "type": "object",
          "description": "The Comparator (reconciliation) run that classified the draft. Absent when the register had no active record to compare with.",
          "properties": {
            "model": { "type": "string", "minLength": 1 },
            "prompt_version": { "type": "string", "minLength": 1 },
            "attempts": { "type": "integer", "minimum": 1 },
            "candidates": {
              "type": "array",
              "minItems": 1,
              "description": "The records the Comparator was shown, in Rerank order, with their Rerank relevance scores.",
              "items": {
                "type": "object",
                "properties": {
                  "record_id": { "$ref": "#/$defs/record_id" },
                  "score": { "type": "number" }
                },
                "required": ["record_id", "score"],
                "additionalProperties": false
              }
            }
          },
          "required": ["model", "prompt_version", "attempts", "candidates"],
          "additionalProperties": false
        }
      },
      "required": ["register", "record_id", "model", "prompt_version", "schema_version"],
      "additionalProperties": false
    },
    "rejected_draft": {
      "type": "object",
      "description": "A draft that failed validation or comparison, listed without its error messages: evidence errors quote the model's draft, which is unvalidated model text.",
      "properties": {
        "register": { "type": "string", "pattern": "^[a-z][a-z0-9-]*$" },
        "stage": {
          "enum": ["draft", "comparison"],
          "description": "Where the draft was rejected: by the Registrar's checks or by the Comparator's. Absent means draft."
        },
        "attempts": { "type": "integer", "minimum": 1 },
        "prompt_version": { "type": "string", "minLength": 1 },
        "error_paths": {
          "type": "array",
          "minItems": 1,
          "uniqueItems": true,
          "items": { "type": "string", "pattern": "^\\$", "maxLength": 200 },
          "description": "JSON paths of the last attempt's errors, for example $.evidence[1]. Just $ when the last response was unusable."
        },
        "error_type": {
          "type": "string",
          "pattern": "^[A-Za-z_][A-Za-z0-9_]*$",
          "maxLength": 100,
          "description": "Project exception class name, present when the last response was unusable, for example LLMResponseError."
        },
        "run_id": {
          "type": "string",
          "format": "uuid",
          "description": "The run that rejected the draft; the run_id of a processed history entry."
        }
      },
      "required": ["register", "attempts", "prompt_version", "error_paths"],
      "additionalProperties": false
    },
    "history_entry": {
      "type": "object",
      "properties": {
        "at": { "$ref": "#/$defs/timestamp" },
        "status": { "$ref": "#/$defs/status" },
        "by": {
          "enum": ["sensor", "operator", "pipeline", "governor"],
          "description": "Who made the change. pipeline stands in for the Governor (orchestrator) until it exists; governor is reserved."
        },
        "check": {
          "enum": ["unsupported-format", "empty", "encoding", "oversized", "delimiter"],
          "description": "The Sensor check that rejected or quarantined the artifact."
        },
        "reason": {
          "type": "string",
          "minLength": 1,
          "maxLength": 500,
          "description": "Why, written by code or by the Operator; never artifact text or model output."
        },
        "run_id": {
          "type": "string",
          "format": "uuid",
          "description": "The run whose LLM events belong to this change (processed and failed only)."
        },
        "error_type": {
          "type": "string",
          "pattern": "^[A-Za-z_][A-Za-z0-9_]*$",
          "maxLength": 100,
          "description": "Project exception class name (failed only), for example LLMRateLimitError."
        }
      },
      "required": ["at", "status", "by"],
      "additionalProperties": false
    }
  }
}
