{
  "schema_version": "1.1",
  "id": "ART-0004",
  "title": "Tallyleaf design review: count screen",
  "source": {
    "type": "file",
    "name": "design-review-2026-03-31.md"
  },
  "artifact_date": "2026-03-31",
  "media_type": "text/markdown",
  "size_bytes": 955,
  "content_hash": "sha256:40597e9070dbbe3e0d0ce20ec96a3b5ca42b469f8972c8d77c206eb39147038e",
  "stored_path": "artifacts/ART-0004-design-review-2026-03-31.md",
  "status": "processed",
  "created_at": "2026-10-31T14:17:28Z",
  "updated_at": "2026-10-31T15:26:04Z",
  "produced": [
    {
      "register": "decision-log",
      "record_id": "DEC-0002",
      "change": "update",
      "model": "command-a-plus-05-2026",
      "prompt_version": "decision-registrar.v1",
      "schema_version": "1.0",
      "comparison": {
        "model": "command-a-plus-05-2026",
        "prompt_version": "decision-comparator.v1",
        "attempts": 1,
        "candidates": [
          {
            "record_id": "DEC-0002",
            "score": 0.30758846
          },
          {
            "record_id": "DEC-0001",
            "score": 0.0070308046
          }
        ]
      }
    }
  ],
  "rejected": [],
  "history": [
    {
      "at": "2026-10-31T14:17:28Z",
      "status": "received",
      "by": "sensor"
    },
    {
      "at": "2026-10-31T14:17:28Z",
      "status": "accepted",
      "by": "sensor"
    },
    {
      "at": "2026-10-31T15:26:04Z",
      "status": "processed",
      "by": "pipeline",
      "run_id": "e9a931d1-56c7-4aba-b3bc-bb27400a538a"
    }
  ]
}
