{
  "schema_version": "1.1",
  "id": "ART-0005",
  "title": "Tallyleaf greenhouse inventory app: project board meeting",
  "source": {
    "type": "file",
    "name": "project-board-2026-04-28.md"
  },
  "artifact_date": "2026-04-28",
  "media_type": "text/markdown",
  "size_bytes": 1276,
  "content_hash": "sha256:f85973a0d456afc0802e08f9db37ae8e8f904ebde5516941cf1ccfc0651e4c84",
  "stored_path": "artifacts/ART-0005-project-board-2026-04-28.md",
  "status": "processed",
  "created_at": "2026-10-31T14:17:29Z",
  "updated_at": "2026-10-31T15:40:42Z",
  "produced": [
    {
      "register": "decision-log",
      "record_id": "DEC-0003",
      "change": "supersession",
      "related_id": "DEC-0002",
      "model": "command-a-plus-05-2026",
      "prompt_version": "decision-registrar.v1",
      "schema_version": "1.0",
      "comparison": {
        "model": "command-a-plus-05-2026",
        "prompt_version": "decision-comparator.v1",
        "attempts": 1,
        "candidates": [
          {
            "record_id": "DEC-0002",
            "score": 0.29192856
          },
          {
            "record_id": "DEC-0001",
            "score": 0.013038341
          }
        ]
      }
    }
  ],
  "rejected": [],
  "history": [
    {
      "at": "2026-10-31T14:17:29Z",
      "status": "received",
      "by": "sensor"
    },
    {
      "at": "2026-10-31T14:17:29Z",
      "status": "accepted",
      "by": "sensor"
    },
    {
      "at": "2026-10-31T15:40:42Z",
      "status": "processed",
      "by": "pipeline",
      "run_id": "8bd8beb3-0e9c-421f-b8fc-2a9ad7c841d3"
    }
  ]
}
